{
  "date": "2026-06-03",
  "title": "Market Beat — News Impact Analysis",
  "subtitle": "16 headlines · 3 levels · 47 tickers · AI bid vs. Gulf war risk",
  "region": "GLOBAL",
  "version": "0.2",
  "sources": [
    "Yahoo Finance",
    "CNBC",
    "Reuters",
    "MarketWatch",
    "Investopedia",
    "TheStreet"
  ],
  "mood": [
    {
      "label": "S&P 500 (fut)",
      "value": "7,581",
      "delta": "-0.42%",
      "tone": "neg"
    },
    {
      "label": "Nasdaq 100 (fut)",
      "value": "30,372",
      "delta": "-0.63%",
      "tone": "neg"
    },
    {
      "label": "Dow (fut)",
      "value": "50,898",
      "delta": "-0.46%",
      "tone": "neg"
    },
    {
      "label": "S&P 500 (prev close)",
      "value": "7,609.78",
      "delta": "+0.13% · ATH",
      "tone": "pos"
    },
    {
      "label": "Russell 2000",
      "value": "+0.90%",
      "delta": "leader",
      "tone": "pos"
    },
    {
      "label": "WTI Crude",
      "value": "$95.40",
      "delta": "+2.0% (3rd day up)",
      "tone": "neg"
    },
    {
      "label": "Brent",
      "value": "~$98",
      "delta": "Gulf escalation",
      "tone": "neg"
    },
    {
      "label": "10Y Treasury",
      "value": "4.46%",
      "delta": "steady",
      "tone": "neu"
    },
    {
      "label": "USD/JPY",
      "value": "159.86",
      "delta": "near 160 (intervention watch)",
      "tone": "neu"
    },
    {
      "label": "Bitcoin",
      "value": "$66,123",
      "delta": "-10% / 3 sessions · 2-mo low",
      "tone": "neg"
    },
    {
      "label": "VIX",
      "value": "~16",
      "delta": "low despite war",
      "tone": "neu"
    },
    {
      "label": "Gold",
      "value": "~$4,486",
      "delta": "+0.4%",
      "tone": "pos"
    }
  ],
  "macro": {
    "headline": "Jobs Week + Beige Book today; payrolls Friday is the hike-odds swing event under new Chair Warsh",
    "regime": "HAWKISH TILT — oil-driven inflation has flipped the market from rate cuts to ~70% odds of a hike by year-end; <3% chance of a 2026 cut priced.",
    "keyEvents": [
      {
        "label": "Fed (FOMC)",
        "value": "Jun 16-17",
        "detail": "Warsh's 1st meeting as Chair; decision Jun 17. No Fed speak until then.",
        "when": "ahead",
        "tone": "neu"
      },
      {
        "label": "Jobs (NFP)",
        "value": "Fri Jun 5",
        "detail": "May payrolls fcst ~85-95k (vs +115k); U-rate 4.3%. The week's main event.",
        "when": "week",
        "tone": "neu"
      },
      {
        "label": "CPI",
        "value": "Jun 13",
        "detail": "May inflation; last print +3.8% YoY, hottest since 2024 on gas/oil.",
        "when": "ahead",
        "tone": "neg"
      },
      {
        "label": "ADP Jobs",
        "value": "Today 8:15a",
        "detail": "May private payrolls fcst +116k (vs +109k). NFP appetizer.",
        "when": "today",
        "tone": "neu"
      }
    ],
    "today": [
      {
        "time": "8:15a ET",
        "event": "ADP National Employment (May)",
        "importance": "high",
        "forecast": "+116k",
        "prior": "+109k",
        "tone": "neu"
      },
      {
        "time": "10:00a ET",
        "event": "ISM Services PMI (May)",
        "importance": "high",
        "forecast": "~52",
        "prior": "51.6",
        "tone": "neu"
      },
      {
        "time": "10:00a ET",
        "event": "Factory Orders (Apr)",
        "importance": "med",
        "forecast": "—",
        "prior": "—",
        "tone": "neu"
      },
      {
        "time": "2:00p ET",
        "event": "Fed Beige Book",
        "importance": "high",
        "forecast": "n/a",
        "prior": "n/a",
        "tone": "neu"
      },
      {
        "time": "9:00a ET",
        "event": "Fed Gov. Barr speaks",
        "importance": "med",
        "forecast": "n/a",
        "prior": "n/a",
        "tone": "neu"
      }
    ],
    "tomorrow": [
      {
        "time": "8:30a ET",
        "event": "Weekly Jobless Claims (wk May 30)",
        "importance": "high",
        "forecast": "~213k",
        "prior": "215k",
        "tone": "neu"
      },
      {
        "time": "8:30a ET",
        "event": "Q1 Productivity / Unit Labor Costs (rev)",
        "importance": "med",
        "forecast": "—",
        "prior": "—",
        "tone": "neu"
      },
      {
        "time": "5:30a ET",
        "event": "Challenger Layoffs (May)",
        "importance": "med",
        "forecast": "n/a",
        "prior": "n/a",
        "tone": "neg"
      },
      {
        "time": "10:30a ET",
        "event": "EIA Natural Gas / Crude Inventories",
        "importance": "low",
        "forecast": "—",
        "prior": "—",
        "tone": "neu"
      }
    ],
    "week": [
      {
        "date": "Mon Jun 1",
        "event": "ISM Manufacturing (May) — 4-yr high; Construction Spending",
        "importance": "med",
        "status": "done",
        "tone": "pos"
      },
      {
        "date": "Tue Jun 2",
        "event": "JOLTS Job Openings (Apr): 7.62M, 2-yr high (vs 6.87M est)",
        "importance": "high",
        "status": "done",
        "tone": "pos"
      },
      {
        "date": "Wed Jun 3",
        "event": "ADP (May), ISM Services, Factory Orders, Beige Book 2p",
        "importance": "high",
        "status": "today",
        "tone": "neu"
      },
      {
        "date": "Thu Jun 4",
        "event": "Jobless Claims, Productivity/ULC, Challenger Layoffs",
        "importance": "med",
        "status": "ahead",
        "tone": "neu"
      },
      {
        "date": "Fri Jun 5",
        "event": "NONFARM PAYROLLS (May) + Unemployment + AHE; Consumer Credit",
        "importance": "high",
        "status": "ahead",
        "tone": "neg"
      }
    ]
  },
  "news": [
    {
      "id": 1,
      "headline": "Marvell soars +32.5% to record — Huang calls it the 'next trillion-dollar company'",
      "source": "Reuters · 1d ago",
      "url": "https://www.thestreet.com/stock-market-today/stock-market-today-dow-jones-sp-500-nasdaq-updates-june-02-2026",
      "category": "AI · Semis",
      "priority": 10,
      "confidence": "HIGH",
      "sentiment": "bull",
      "tickers": [
        {
          "symbol": "MRVL",
          "score": 3
        },
        {
          "symbol": "NVDA",
          "score": 1
        },
        {
          "symbol": "AVGO",
          "score": 2
        }
      ],
      "levels": {
        "L1": {
          "text": "Marvell ripped +32.5% to a record $290.79 (mkt cap ~$254B) after Nvidia CEO Jensen Huang called it the 'next trillion-dollar company' at Computex Taipei, citing its role in data-center connectivity and custom XPUs. Nvidia invested $2B in MRVL earlier this year; Marvell guides custom-silicon revenue >$10B by FY29. The Philadelphia Semi Index jumped ~6%.",
          "tickers": [
            {
              "symbol": "MRVL",
              "score": 3
            }
          ]
        },
        "L2": {
          "text": "Halo bid across custom-silicon and optical/networking peers. AVGO (reports Wed) is the obvious sympathy beneficiary as the other hyperscaler ASIC franchise; optical/interconnect names CRDO, COHR, LITE, ANET ride the connectivity narrative. NVDA benefits as ecosystem orchestrator, not loser.",
          "tickers": [
            {
              "symbol": "AVGO",
              "score": 2
            },
            {
              "symbol": "ANET",
              "score": 1
            },
            {
              "symbol": "CRDO",
              "score": 1
            }
          ]
        },
        "L3": {
          "text": "Reinforces the 'custom silicon eats merchant GPU share at the margin' structural thesis: hyperscalers (GOOGL TPU, AMZN Trainium, MSFT Maia) increasingly co-design accelerators, and MRVL/AVGO are the arms dealers. Concentration risk rises — MU, NVDA, GOOGL alone drive 40%+ of YTD S&P 2026 EPS revisions (Evercore).",
          "tickers": [
            {
              "symbol": "AMD",
              "score": -1
            },
            {
              "symbol": "INTC",
              "score": -1
            }
          ]
        }
      },
      "beneficiaries": [
        "MRVL — Huang endorsement + $10B FY29 custom-silicon TAM",
        "AVGO — peer ASIC re-rate into Wed print",
        "ANET — interconnect demand",
        "CRDO — AI connectivity halo",
        "NVDA — ecosystem orchestrator"
      ],
      "victims": [
        "AMD — merchant-GPU share narrative pressure",
        "INTC — outside the custom-silicon party"
      ],
      "timeline": {
        "D": "Momentum chase + sell-side PT hikes; watch for profit-taking after a 32% pop.",
        "W": "AVGO earnings (Wed) becomes the read-through catalyst for the whole ASIC complex.",
        "M": "Custom-silicon backlog/booking commentary tests the $10B FY29 framing.",
        "L": "Hyperscaler in-house accelerator model entrenches MRVL/AVGO as core suppliers."
      }
    },
    {
      "id": 2,
      "headline": "HPE rockets +19.5% — biggest beat since 2018 as AI servers accelerate financial targets by 2 years",
      "source": "CNBC · 1d ago",
      "url": "https://finance.yahoo.com/sectors/technology/live/tech-stocks-today-google-stock-falls-on-plans-to-raise-80-billion-nvidia-ceo-blesses-marvell-stock-100000832.html",
      "category": "AI · Hardware",
      "priority": 9,
      "confidence": "HIGH",
      "sentiment": "bull",
      "tickers": [
        {
          "symbol": "HPE",
          "score": 3
        },
        {
          "symbol": "DELL",
          "score": 2
        },
        {
          "symbol": "SMCI",
          "score": 1
        }
      ],
      "levels": {
        "L1": {